<PurchaseOrder xmlns:xsi="http://www.w3.org/2001/XMLSchema-instance" xsi:noNamespaceSchemaLocation="http://localhost:8080/source/schemas/poSource/xsd/purchaseOrder.xsd">
   <Reference>AWALSH-20021009123336642PDT</Reference>
   <Actions>
      <Action>
         <User>KPARTNER</User>
      </Action>
   </Actions>
   <Reject/>
   <Requestor>Alana G. Walsh</Requestor>
   <User>AWALSH</User>
   <CostCenter>S30</CostCenter>
   <ShippingInstructions>
      <name>Alana G. Walsh</name>
      <address>1200 East Forty Seventh Avenue 
New York
NY
10024
USA</address>
      <telephone>212 555 1212</telephone>
   </ShippingInstructions>
   <SpecialInstructions>Expedite</SpecialInstructions>
   <LineItems>
      <LineItem ItemNumber="1">
         <Description>Under the Roofs of Paris</Description>
         <Part Id="37429168929" UnitPrice="29.95" Quantity="3"/>
      </LineItem>
      <LineItem ItemNumber="2">
         <Description>Vagabond</Description>
         <Part Id="37429148921" UnitPrice="29.95" Quantity="3"/>
      </LineItem>
      <LineItem ItemNumber="3">
         <Description>George Washington</Description>
         <Part Id="37429166123" UnitPrice="39.95" Quantity="2"/>
      </LineItem>
      <LineItem ItemNumber="4">
         <Description>The 400 Blows</Description>
         <Part Id="37429122228" UnitPrice="39.95" Quantity="4"/>
      </LineItem>
      <LineItem ItemNumber="5">
         <Description>Shock Corridor</Description>
         <Part Id="37429125922" UnitPrice="29.95" Quantity="4"/>
      </LineItem>
      <LineItem ItemNumber="6">
         <Description>The Seventh Seal</Description>
         <Part Id="37429124529" UnitPrice="39.95" Quantity="4"/>
      </LineItem>
      <LineItem ItemNumber="7">
         <Description>Oliver Twist</Description>
         <Part Id="37429128121" UnitPrice="39.95" Quantity="1"/>
      </LineItem>
      <LineItem ItemNumber="8">
         <Description>Salo</Description>
         <Part Id="715515009225" UnitPrice="29.95" Quantity="3"/>
      </LineItem>
      <LineItem ItemNumber="9">
         <Description>In the Mood for Love</Description>
         <Part Id="715515012928" UnitPrice="39.95" Quantity="3"/>
      </LineItem>
      <LineItem ItemNumber="10">
         <Description>Wild Strawberries</Description>
         <Part Id="37429162422" UnitPrice="39.95" Quantity="3"/>
      </LineItem>
      <LineItem ItemNumber="11">
         <Description>Day of Wrath </Description>
         <Part Id="37429158722" UnitPrice="0.0" Quantity="1"/>
      </LineItem>
      <LineItem ItemNumber="12">
         <Description>Juliet of the Spirits</Description>
         <Part Id="37429165829" UnitPrice="29.95" Quantity="2"/>
      </LineItem>
      <LineItem ItemNumber="13">
         <Description>Time Bandits</Description>
         <Part Id="715515010122" UnitPrice="39.95" Quantity="3"/>
      </LineItem>
      <LineItem ItemNumber="14">
         <Description>Under the Roofs of Paris</Description>
         <Part Id="37429168929" UnitPrice="29.95" Quantity="1"/>
      </LineItem>
      <LineItem ItemNumber="15">
         <Description>Variety Lights</Description>
         <Part Id="37429150023" UnitPrice="29.95" Quantity="2"/>
      </LineItem>
      <LineItem ItemNumber="16">
         <Description>Armageddon</Description>
         <Part Id="715515010023" UnitPrice="49.99" Quantity="2"/>
      </LineItem>
      <LineItem ItemNumber="17">
         <Description>Rebecca</Description>
         <Part Id="715515012522" UnitPrice="39.95" Quantity="1"/>
      </LineItem>
      <LineItem ItemNumber="18">
         <Description>Bob le Flambeur</Description>
         <Part Id="37429165928" UnitPrice="29.95" Quantity="1"/>
      </LineItem>
   </LineItems>
</PurchaseOrder>

