<PurchaseOrder xmlns:xsi="http://www.w3.org/2001/XMLSchema-instance" xsi:noNamespaceSchemaLocation="http://localhost:8080/source/schemas/poSource/xsd/purchaseOrder.xsd">
   <Reference>VJONES-20021009123335971PDT</Reference>
   <Actions>
      <Action>
         <User>SVOLLMAN</User>
      </Action>
   </Actions>
   <Reject/>
   <Requestor>Vance L. Jones</Requestor>
   <User>VJONES</User>
   <CostCenter>R20</CostCenter>
   <ShippingInstructions>
      <name>Vance L. Jones</name>
      <address>600 Oracle Parkway
Redwood Shores
CA
94065
USA</address>
      <telephone>650 506 7600</telephone>
   </ShippingInstructions>
   <SpecialInstructions>Courier</SpecialInstructions>
   <LineItems>
      <LineItem ItemNumber="1">
         <Description>George Washington</Description>
         <Part Id="37429166123" UnitPrice="39.95" Quantity="1"/>
      </LineItem>
      <LineItem ItemNumber="2">
         <Description>Wages of Fear</Description>
         <Part Id="37429134924" UnitPrice="29.95" Quantity="4"/>
      </LineItem>
      <LineItem ItemNumber="3">
         <Description>Grey Gardens</Description>
         <Part Id="37429159125" UnitPrice="39.95" Quantity="2"/>
      </LineItem>
      <LineItem ItemNumber="4">
         <Description>M. Hulot's Holiday</Description>
         <Part Id="37429155721" UnitPrice="29.95" Quantity="1"/>
      </LineItem>
      <LineItem ItemNumber="5">
         <Description>Black Orpheus</Description>
         <Part Id="37429138328" UnitPrice="29.95" Quantity="3"/>
      </LineItem>
      <LineItem ItemNumber="6">
         <Description>Diabolique</Description>
         <Part Id="37429135020" UnitPrice="29.95" Quantity="4"/>
      </LineItem>
      <LineItem ItemNumber="7">
         <Description>Insomnia</Description>
         <Part Id="37429138229" UnitPrice="29.95" Quantity="2"/>
      </LineItem>
      <LineItem ItemNumber="8">
         <Description>The Firemen's Ball</Description>
         <Part Id="37429165522" UnitPrice="29.95" Quantity="3"/>
      </LineItem>
      <LineItem ItemNumber="9">
         <Description>Dead Ringers</Description>
         <Part Id="715515009249" UnitPrice="39.95" Quantity="1"/>
      </LineItem>
      <LineItem ItemNumber="10">
         <Description>Brazil</Description>
         <Part Id="37429138526" UnitPrice="59.95" Quantity="1"/>
      </LineItem>
      <LineItem ItemNumber="11">
         <Description>I Know Where I'm Going</Description>
         <Part Id="37429154427" UnitPrice="39.95" Quantity="1"/>
      </LineItem>
      <LineItem ItemNumber="12">
         <Description>Time Bandits</Description>
         <Part Id="715515010122" UnitPrice="39.95" Quantity="4"/>
      </LineItem>
      <LineItem ItemNumber="13">
         <Description>Fiend without a Face</Description>
         <Part Id="715515011327" UnitPrice="39.95" Quantity="3"/>
      </LineItem>
      <LineItem ItemNumber="14">
         <Description>The Last Temptation of Christ</Description>
         <Part Id="715515010528" UnitPrice="39.95" Quantity="4"/>
      </LineItem>
      <LineItem ItemNumber="15">
         <Description>The Cranes Are Flying</Description>
         <Part Id="37429168028" UnitPrice="29.95" Quantity="1"/>
      </LineItem>
      <LineItem ItemNumber="16">
         <Description>The Bank Dick</Description>
         <Part Id="715515010627" UnitPrice="29.95" Quantity="4"/>
      </LineItem>
      <LineItem ItemNumber="17">
         <Description>Eisenstein: The Sound Years</Description>
         <Part Id="37429149126" UnitPrice="79.95" Quantity="3"/>
      </LineItem>
      <LineItem ItemNumber="18">
         <Description>Orpheus</Description>
         <Part Id="37429141427" UnitPrice="0.0" Quantity="2"/>
      </LineItem>
      <LineItem ItemNumber="19">
         <Description>Ballad of a Soldier</Description>
         <Part Id="37429167922" UnitPrice="29.95" Quantity="1"/>
      </LineItem>
      <LineItem ItemNumber="20">
         <Description>The Scarlet Empress</Description>
         <Part Id="715515011822" UnitPrice="29.95" Quantity="4"/>
      </LineItem>
      <LineItem ItemNumber="21">
         <Description>Fishing With John 1 -3</Description>
         <Part Id="37429136621" UnitPrice="29.95" Quantity="2"/>
      </LineItem>
      <LineItem ItemNumber="22">
         <Description>Dead Ringers</Description>
         <Part Id="715515009249" UnitPrice="39.95" Quantity="1"/>
      </LineItem>
   </LineItems>
</PurchaseOrder>

