<PurchaseOrder xmlns:xsi="http://www.w3.org/2001/XMLSchema-instance" xsi:noNamespaceSchemaLocation="http://localhost:8080/source/schemas/poSource/xsd/purchaseOrder.xsd">
   <Reference>TFOX-2002100912333681PDT</Reference>
   <Actions>
      <Action>
         <User>GCAMBRAU</User>
      </Action>
   </Actions>
   <Reject/>
   <Requestor>Tayler L. Fox</Requestor>
   <User>TFOX</User>
   <CostCenter>R20</CostCenter>
   <ShippingInstructions>
      <name>Tayler L. Fox</name>
      <address>100 Oracle Parkway
Redwood Shores
CA
94065
USA</address>
      <telephone>650 506 7100</telephone>
   </ShippingInstructions>
   <SpecialInstructions>Counter to Counter</SpecialInstructions>
   <LineItems>
      <LineItem ItemNumber="1">
         <Description>Autumn Sonata</Description>
         <Part Id="37429126127" UnitPrice="39.95" Quantity="4"/>
      </LineItem>
      <LineItem ItemNumber="2">
         <Description>The Cranes Are Flying</Description>
         <Part Id="37429168028" UnitPrice="29.95" Quantity="2"/>
      </LineItem>
      <LineItem ItemNumber="3">
         <Description>Alphaville</Description>
         <Part Id="37429130926" UnitPrice="29.95" Quantity="4"/>
      </LineItem>
      <LineItem ItemNumber="4">
         <Description>Beauty and the Beast</Description>
         <Part Id="37429122020" UnitPrice="39.95" Quantity="2"/>
      </LineItem>
      <LineItem ItemNumber="5">
         <Description>Seven Samurai</Description>
         <Part Id="37429121726" UnitPrice="39.95" Quantity="1"/>
      </LineItem>
      <LineItem ItemNumber="6">
         <Description>Samurai 3: Duel at Ganryu Island</Description>
         <Part Id="37429125625" UnitPrice="29.95" Quantity="4"/>
      </LineItem>
      <LineItem ItemNumber="7">
         <Description>Playtime</Description>
         <Part Id="37429155820" UnitPrice="29.95" Quantity="4"/>
      </LineItem>
      <LineItem ItemNumber="8">
         <Description>The Long Good Friday</Description>
         <Part Id="715515009621" UnitPrice="29.95" Quantity="1"/>
      </LineItem>
      <LineItem ItemNumber="9">
         <Description>The Blob</Description>
         <Part Id="715515011129" UnitPrice="39.95" Quantity="1"/>
      </LineItem>
      <LineItem ItemNumber="10">
         <Description>8.5</Description>
         <Part Id="37429135624" UnitPrice="39.95" Quantity="3"/>
      </LineItem>
      <LineItem ItemNumber="11">
         <Description>Great Expectations</Description>
         <Part Id="37429128022" UnitPrice="39.95" Quantity="3"/>
      </LineItem>
      <LineItem ItemNumber="12">
         <Description>Big Deal on Madonna Street</Description>
         <Part Id="37429155424" UnitPrice="29.95" Quantity="2"/>
      </LineItem>
      <LineItem ItemNumber="13">
         <Description>Samurai 3: Duel at Ganryu Island</Description>
         <Part Id="37429125625" UnitPrice="29.95" Quantity="2"/>
      </LineItem>
      <LineItem ItemNumber="14">
         <Description>Oliver Twist</Description>
         <Part Id="37429128121" UnitPrice="39.95" Quantity="3"/>
      </LineItem>
      <LineItem ItemNumber="15">
         <Description>Le Trou</Description>
         <Part Id="37429156223" UnitPrice="29.95" Quantity="3"/>
      </LineItem>
      <LineItem ItemNumber="16">
         <Description>Beastie Boys Video Anthology</Description>
         <Part Id="715515010924" UnitPrice="29.95" Quantity="3"/>
      </LineItem>
      <LineItem ItemNumber="17">
         <Description>All That Heaven Allows</Description>
         <Part Id="715515011426" UnitPrice="39.95" Quantity="3"/>
      </LineItem>
      <LineItem ItemNumber="18">
         <Description>Cleo from 5 to 7</Description>
         <Part Id="37429149027" UnitPrice="29.95" Quantity="2"/>
      </LineItem>
      <LineItem ItemNumber="19">
         <Description>Diabolique</Description>
         <Part Id="37429135020" UnitPrice="29.95" Quantity="4"/>
      </LineItem>
      <LineItem ItemNumber="20">
         <Description>Brazil</Description>
         <Part Id="37429138526" UnitPrice="59.95" Quantity="2"/>
      </LineItem>
      <LineItem ItemNumber="21">
         <Description>Blood of a Poet</Description>
         <Part Id="37429147429" UnitPrice="0.0" Quantity="3"/>
      </LineItem>
      <LineItem ItemNumber="22">
         <Description>Diabolique</Description>
         <Part Id="37429135020" UnitPrice="29.95" Quantity="3"/>
      </LineItem>
      <LineItem ItemNumber="23">
         <Description>Dreyer Box Set</Description>
         <Part Id="37429158425" UnitPrice="79.95" Quantity="2"/>
      </LineItem>
      <LineItem ItemNumber="24">
         <Description>Nanook of the North</Description>
         <Part Id="715515009829" UnitPrice="29.95" Quantity="3"/>
      </LineItem>
      <LineItem ItemNumber="25">
         <Description>Orphic Trilogy </Description>
         <Part Id="37429148327" UnitPrice="79.95" Quantity="2"/>
      </LineItem>
   </LineItems>
</PurchaseOrder>

