<PurchaseOrder xmlns:xsi="http://www.w3.org/2001/XMLSchema-instance" xsi:noNamespaceSchemaLocation="http://localhost:8080/source/schemas/poSource/xsd/purchaseOrder.xsd">
   <Reference>VJONES-20021009123336502PDT</Reference>
   <Actions>
      <Action>
         <User>SVOLLMAN</User>
      </Action>
   </Actions>
   <Reject/>
   <Requestor>Vance L. Jones</Requestor>
   <User>VJONES</User>
   <CostCenter>R20</CostCenter>
   <ShippingInstructions>
      <name>Vance L. Jones</name>
      <address>600 Oracle Parkway
Redwood Shores
CA
94065
USA</address>
      <telephone>650 506 7600</telephone>
   </ShippingInstructions>
   <SpecialInstructions>Courier</SpecialInstructions>
   <LineItems>
      <LineItem ItemNumber="1">
         <Description>Black Orpheus</Description>
         <Part Id="37429138328" UnitPrice="29.95" Quantity="4"/>
      </LineItem>
      <LineItem ItemNumber="2">
         <Description>Charade</Description>
         <Part Id="37429139424" UnitPrice="39.95" Quantity="4"/>
      </LineItem>
      <LineItem ItemNumber="3">
         <Description>Orpheus</Description>
         <Part Id="37429141427" UnitPrice="0.0" Quantity="3"/>
      </LineItem>
      <LineItem ItemNumber="4">
         <Description>I Know Where I'm Going</Description>
         <Part Id="37429154427" UnitPrice="39.95" Quantity="3"/>
      </LineItem>
      <LineItem ItemNumber="5">
         <Description>Wages of Fear</Description>
         <Part Id="37429134924" UnitPrice="29.95" Quantity="4"/>
      </LineItem>
      <LineItem ItemNumber="6">
         <Description>Le million</Description>
         <Part Id="37429147627" UnitPrice="29.95" Quantity="3"/>
      </LineItem>
      <LineItem ItemNumber="7">
         <Description>The Third Man</Description>
         <Part Id="37429141625" UnitPrice="39.95" Quantity="2"/>
      </LineItem>
      <LineItem ItemNumber="8">
         <Description>Black Orpheus</Description>
         <Part Id="37429138328" UnitPrice="29.95" Quantity="3"/>
      </LineItem>
      <LineItem ItemNumber="9">
         <Description>Salesman</Description>
         <Part Id="37429158920" UnitPrice="39.95" Quantity="2"/>
      </LineItem>
      <LineItem ItemNumber="10">
         <Description>The 400 Blows</Description>
         <Part Id="37429122228" UnitPrice="39.95" Quantity="1"/>
      </LineItem>
   </LineItems>
</PurchaseOrder>

