<PurchaseOrder xmlns:xsi="http://www.w3.org/2001/XMLSchema-instance" xsi:noNamespaceSchemaLocation="http://localhost:8080/source/schemas/poSource/xsd/purchaseOrder.xsd">
   <Reference>EABEL-20021009123335791PDT</Reference>
   <Actions>
      <Action>
         <User>EZLOTKEY</User>
      </Action>
   </Actions>
   <Reject/>
   <Requestor>Ellen S. Abel</Requestor>
   <User>EABEL</User>
   <CostCenter>R20</CostCenter>
   <ShippingInstructions>
      <name>Ellen S. Abel</name>
      <address>300 Oracle Parkway
Redwood Shores
CA
94065
USA</address>
      <telephone>650 506 7300</telephone>
   </ShippingInstructions>
   <SpecialInstructions>Ground</SpecialInstructions>
   <LineItems>
      <LineItem ItemNumber="1">
         <Description>Kwaidan</Description>
         <Part Id="37429152027" UnitPrice="29.95" Quantity="4"/>
      </LineItem>
      <LineItem ItemNumber="2">
         <Description>Alphaville</Description>
         <Part Id="37429130926" UnitPrice="29.95" Quantity="3"/>
      </LineItem>
      <LineItem ItemNumber="3">
         <Description>Andrei Rublev</Description>
         <Part Id="715515009928" UnitPrice="39.95" Quantity="3"/>
      </LineItem>
      <LineItem ItemNumber="4">
         <Description>Variety Lights</Description>
         <Part Id="37429150023" UnitPrice="29.95" Quantity="1"/>
      </LineItem>
      <LineItem ItemNumber="5">
         <Description>Rushmore</Description>
         <Part Id="715515010429" UnitPrice="39.95" Quantity="3"/>
      </LineItem>
      <LineItem ItemNumber="6">
         <Description>The Lady Eve</Description>
         <Part Id="715515011624" UnitPrice="39.95" Quantity="4"/>
      </LineItem>
      <LineItem ItemNumber="7">
         <Description>Brazil</Description>
         <Part Id="37429138526" UnitPrice="59.95" Quantity="3"/>
      </LineItem>
      <LineItem ItemNumber="8">
         <Description>Life of Brian - Monty Python's</Description>
         <Part Id="715515010320" UnitPrice="39.95" Quantity="4"/>
      </LineItem>
      <LineItem ItemNumber="9">
         <Description>The Discreet Charm of Bourgeoisie</Description>
         <Part Id="37429154625" UnitPrice="39.95" Quantity="2"/>
      </LineItem>
      <LineItem ItemNumber="10">
         <Description>And the Ship Sails on</Description>
         <Part Id="37429139028" UnitPrice="29.95" Quantity="2"/>
      </LineItem>
      <LineItem ItemNumber="11">
         <Description>Beauty and the Beast</Description>
         <Part Id="37429122020" UnitPrice="39.95" Quantity="4"/>
      </LineItem>
      <LineItem ItemNumber="12">
         <Description>Beauty and the Beast</Description>
         <Part Id="37429122020" UnitPrice="39.95" Quantity="3"/>
      </LineItem>
      <LineItem ItemNumber="13">
         <Description>Branded to Kill</Description>
         <Part Id="37429136225" UnitPrice="29.95" Quantity="2"/>
      </LineItem>
      <LineItem ItemNumber="14">
         <Description>Branded to Kill</Description>
         <Part Id="37429136225" UnitPrice="29.95" Quantity="2"/>
      </LineItem>
      <LineItem ItemNumber="15">
         <Description>And the Ship Sails on</Description>
         <Part Id="37429139028" UnitPrice="29.95" Quantity="4"/>
      </LineItem>
      <LineItem ItemNumber="16">
         <Description>Ballad of a Soldier</Description>
         <Part Id="37429167922" UnitPrice="29.95" Quantity="3"/>
      </LineItem>
      <LineItem ItemNumber="17">
         <Description>Notorious</Description>
         <Part Id="715515012720" UnitPrice="39.95" Quantity="2"/>
      </LineItem>
      <LineItem ItemNumber="18">
         <Description>Big Deal on Madonna Street</Description>
         <Part Id="37429155424" UnitPrice="29.95" Quantity="1"/>
      </LineItem>
      <LineItem ItemNumber="19">
         <Description>Le million</Description>
         <Part Id="37429147627" UnitPrice="29.95" Quantity="2"/>
      </LineItem>
      <LineItem ItemNumber="20">
         <Description>M</Description>
         <Part Id="37429126523" UnitPrice="29.95" Quantity="3"/>
      </LineItem>
      <LineItem ItemNumber="21">
         <Description>Life of Brian - Monty Python's</Description>
         <Part Id="715515010320" UnitPrice="39.95" Quantity="2"/>
      </LineItem>
   </LineItems>
</PurchaseOrder>

