<PurchaseOrder xmlns:xsi="http://www.w3.org/2001/XMLSchema-instance" xsi:noNamespaceSchemaLocation="http://localhost:8080/source/schemas/poSource/xsd/purchaseOrder.xsd">
   <Reference>CJOHNSON-20021009123338595PDT</Reference>
   <Actions>
      <Action>
         <User>EZLOTKEY</User>
      </Action>
   </Actions>
   <Reject/>
   <Requestor>Charles G. Johnson</Requestor>
   <User>CJOHNSON</User>
   <CostCenter>S30</CostCenter>
   <ShippingInstructions>
      <name>Charles G. Johnson</name>
      <address>500 Oracle Parkway
Redwood Shores
CA
94065
USA</address>
      <telephone>650 506 7500</telephone>
   </ShippingInstructions>
   <SpecialInstructions>Courier</SpecialInstructions>
   <LineItems>
      <LineItem ItemNumber="1">
         <Description>Autumn Sonata</Description>
         <Part Id="37429126127" UnitPrice="39.95" Quantity="4"/>
      </LineItem>
      <LineItem ItemNumber="2">
         <Description>The Night Porter</Description>
         <Part Id="37429145227" UnitPrice="29.95" Quantity="2"/>
      </LineItem>
      <LineItem ItemNumber="3">
         <Description>Big Deal on Madonna Street</Description>
         <Part Id="37429155424" UnitPrice="29.95" Quantity="4"/>
      </LineItem>
      <LineItem ItemNumber="4">
         <Description>Great Expectations</Description>
         <Part Id="37429128022" UnitPrice="39.95" Quantity="2"/>
      </LineItem>
      <LineItem ItemNumber="5">
         <Description>Closely Watched Trains</Description>
         <Part Id="37429161524" UnitPrice="29.95" Quantity="3"/>
      </LineItem>
      <LineItem ItemNumber="6">
         <Description>Robocop</Description>
         <Part Id="715515009324" UnitPrice="39.95" Quantity="3"/>
      </LineItem>
      <LineItem ItemNumber="7">
         <Description>A Night to Remember</Description>
         <Part Id="715515009058" UnitPrice="39.95" Quantity="1"/>
      </LineItem>
      <LineItem ItemNumber="8">
         <Description>The Importance of Being Earnest</Description>
         <Part Id="37429165621" UnitPrice="29.95" Quantity="2"/>
      </LineItem>
      <LineItem ItemNumber="9">
         <Description>Children of Paradise</Description>
         <Part Id="37429151723" UnitPrice="39.95" Quantity="3"/>
      </LineItem>
      <LineItem ItemNumber="10">
         <Description>Do the Right Thing</Description>
         <Part Id="715515011228" UnitPrice="39.95" Quantity="3"/>
      </LineItem>
      <LineItem ItemNumber="11">
         <Description>Dreyer Box Set</Description>
         <Part Id="37429158425" UnitPrice="79.95" Quantity="3"/>
      </LineItem>
      <LineItem ItemNumber="12">
         <Description>The Harder They Come</Description>
         <Part Id="715515010825" UnitPrice="39.95" Quantity="3"/>
      </LineItem>
      <LineItem ItemNumber="13">
         <Description>Sanjuro</Description>
         <Part Id="37429141526" UnitPrice="29.95" Quantity="1"/>
      </LineItem>
      <LineItem ItemNumber="14">
         <Description>Good Morning</Description>
         <Part Id="37429149621" UnitPrice="29.95" Quantity="4"/>
      </LineItem>
      <LineItem ItemNumber="15">
         <Description>Nights of Cabiria</Description>
         <Part Id="37429138427" UnitPrice="39.95" Quantity="4"/>
      </LineItem>
      <LineItem ItemNumber="16">
         <Description>8.5</Description>
         <Part Id="37429135624" UnitPrice="39.95" Quantity="4"/>
      </LineItem>
      <LineItem ItemNumber="17">
         <Description>Silence of the Lambs</Description>
         <Part Id="715515009133" UnitPrice="39.95" Quantity="2"/>
      </LineItem>
      <LineItem ItemNumber="18">
         <Description>The Long Good Friday</Description>
         <Part Id="715515009621" UnitPrice="29.95" Quantity="4"/>
      </LineItem>
      <LineItem ItemNumber="19">
         <Description>A Night to Remember</Description>
         <Part Id="715515009058" UnitPrice="39.95" Quantity="2"/>
      </LineItem>
      <LineItem ItemNumber="20">
         <Description>Summertime</Description>
         <Part Id="37429130728" UnitPrice="29.95" Quantity="1"/>
      </LineItem>
      <LineItem ItemNumber="21">
         <Description>Red Beard</Description>
         <Part Id="37429168820" UnitPrice="39.95" Quantity="2"/>
      </LineItem>
      <LineItem ItemNumber="22">
         <Description>The Vanishing</Description>
         <Part Id="37429161623" UnitPrice="29.95" Quantity="3"/>
      </LineItem>
      <LineItem ItemNumber="23">
         <Description>The Last Wave</Description>
         <Part Id="37429161920" UnitPrice="29.95" Quantity="4"/>
      </LineItem>
      <LineItem ItemNumber="24">
         <Description>Tokyo Olympiad</Description>
         <Part Id="37429166420" UnitPrice="39.95" Quantity="4"/>
      </LineItem>
   </LineItems>
</PurchaseOrder>

