<PurchaseOrder xmlns:xsi="http://www.w3.org/2001/XMLSchema-instance" xsi:noNamespaceSchemaLocation="http://localhost:8080/source/schemas/poSource/xsd/purchaseOrder.xsd">
   <Reference>TFOX-20021009123336782PDT</Reference>
   <Actions>
      <Action>
         <User>GCAMBRAU</User>
      </Action>
   </Actions>
   <Reject/>
   <Requestor>Tayler L. Fox</Requestor>
   <User>TFOX</User>
   <CostCenter>R20</CostCenter>
   <ShippingInstructions>
      <name>Tayler L. Fox</name>
      <address>100 Oracle Parkway
Redwood Shores
CA
94065
USA</address>
      <telephone>650 506 7100</telephone>
   </ShippingInstructions>
   <SpecialInstructions>Ground</SpecialInstructions>
   <LineItems>
      <LineItem ItemNumber="1">
         <Description>I Know Where I'm Going</Description>
         <Part Id="37429154427" UnitPrice="39.95" Quantity="3"/>
      </LineItem>
      <LineItem ItemNumber="2">
         <Description>Do the Right Thing</Description>
         <Part Id="715515011228" UnitPrice="39.95" Quantity="1"/>
      </LineItem>
      <LineItem ItemNumber="3">
         <Description>That Obscure Object of Desire</Description>
         <Part Id="37429162026" UnitPrice="29.95" Quantity="3"/>
      </LineItem>
      <LineItem ItemNumber="4">
         <Description>Withnail &amp; I</Description>
         <Part Id="715515012225" UnitPrice="29.95" Quantity="1"/>
      </LineItem>
      <LineItem ItemNumber="5">
         <Description>Henry V</Description>
         <Part Id="37429128527" UnitPrice="39.95" Quantity="2"/>
      </LineItem>
      <LineItem ItemNumber="6">
         <Description>Flesh for Frankenstein</Description>
         <Part Id="715515009423" UnitPrice="39.95" Quantity="2"/>
      </LineItem>
      <LineItem ItemNumber="7">
         <Description>The Most Dangerous Game</Description>
         <Part Id="37429137321" UnitPrice="24.95" Quantity="4"/>
      </LineItem>
      <LineItem ItemNumber="8">
         <Description>Ballad of a Soldier</Description>
         <Part Id="37429167922" UnitPrice="29.95" Quantity="3"/>
      </LineItem>
      <LineItem ItemNumber="9">
         <Description>8.5</Description>
         <Part Id="37429135624" UnitPrice="39.95" Quantity="3"/>
      </LineItem>
      <LineItem ItemNumber="10">
         <Description>The Blob</Description>
         <Part Id="715515011129" UnitPrice="39.95" Quantity="4"/>
      </LineItem>
      <LineItem ItemNumber="11">
         <Description>Flesh for Frankenstein</Description>
         <Part Id="715515009423" UnitPrice="39.95" Quantity="1"/>
      </LineItem>
      <LineItem ItemNumber="12">
         <Description>The Seventh Seal</Description>
         <Part Id="37429124529" UnitPrice="39.95" Quantity="2"/>
      </LineItem>
      <LineItem ItemNumber="13">
         <Description>Black Narcissus</Description>
         <Part Id="37429152126" UnitPrice="39.95" Quantity="3"/>
      </LineItem>
      <LineItem ItemNumber="14">
         <Description>Haxan: Witchcraft Through the Ages</Description>
         <Part Id="37429161722" UnitPrice="39.95" Quantity="3"/>
      </LineItem>
      <LineItem ItemNumber="15">
         <Description>General Idi Amin Dada</Description>
         <Part Id="37429166529" UnitPrice="29.95" Quantity="1"/>
      </LineItem>
   </LineItems>
</PurchaseOrder>

