<PurchaseOrder xmlns:xsi="http://www.w3.org/2001/XMLSchema-instance" xsi:noNamespaceSchemaLocation="http://localhost:8080/source/schemas/poSource/xsd/purchaseOrder.xsd">
   <Reference>AMCEWEN-20021009123335370PDT</Reference>
   <Actions>
      <Action>
         <User>KPARTNER</User>
      </Action>
   </Actions>
   <Reject/>
   <Requestor>Allan D. McEwen</Requestor>
   <User>AMCEWEN</User>
   <CostCenter>S30</CostCenter>
   <ShippingInstructions>
      <name>Allan D. McEwen</name>
      <address>Oracle Plaza
Twin Dolphin Drive
Redwood Shores
CA
94065
USA</address>
      <telephone>650 506 7700</telephone>
   </ShippingInstructions>
   <SpecialInstructions>Ground</SpecialInstructions>
   <LineItems>
      <LineItem ItemNumber="1">
         <Description>Juliet of the Spirits</Description>
         <Part Id="37429165829" UnitPrice="29.95" Quantity="1"/>
      </LineItem>
      <LineItem ItemNumber="2">
         <Description>I Know Where I'm Going</Description>
         <Part Id="37429154427" UnitPrice="39.95" Quantity="3"/>
      </LineItem>
      <LineItem ItemNumber="3">
         <Description>Dead Ringers</Description>
         <Part Id="715515009249" UnitPrice="39.95" Quantity="4"/>
      </LineItem>
      <LineItem ItemNumber="4">
         <Description>Ballad of a Soldier</Description>
         <Part Id="37429167922" UnitPrice="29.95" Quantity="1"/>
      </LineItem>
      <LineItem ItemNumber="5">
         <Description>Under the Roofs of Paris</Description>
         <Part Id="37429168929" UnitPrice="29.95" Quantity="1"/>
      </LineItem>
      <LineItem ItemNumber="6">
         <Description>Grey Gardens</Description>
         <Part Id="37429159125" UnitPrice="39.95" Quantity="4"/>
      </LineItem>
      <LineItem ItemNumber="7">
         <Description>Diabolique</Description>
         <Part Id="37429135020" UnitPrice="29.95" Quantity="3"/>
      </LineItem>
      <LineItem ItemNumber="8">
         <Description>The Lady Eve</Description>
         <Part Id="715515011624" UnitPrice="39.95" Quantity="1"/>
      </LineItem>
      <LineItem ItemNumber="9">
         <Description>Oliver Twist</Description>
         <Part Id="37429128121" UnitPrice="39.95" Quantity="3"/>
      </LineItem>
      <LineItem ItemNumber="10">
         <Description>The Magic Flute</Description>
         <Part Id="37429147528" UnitPrice="29.95" Quantity="3"/>
      </LineItem>
      <LineItem ItemNumber="11">
         <Description>The Firemen's Ball</Description>
         <Part Id="37429165522" UnitPrice="29.95" Quantity="4"/>
      </LineItem>
      <LineItem ItemNumber="12">
         <Description>The 39 Steps</Description>
         <Part Id="37429135228" UnitPrice="39.95" Quantity="1"/>
      </LineItem>
      <LineItem ItemNumber="13">
         <Description>The Element of Crime</Description>
         <Part Id="37429149423" UnitPrice="39.95" Quantity="3"/>
      </LineItem>
   </LineItems>
</PurchaseOrder>

