<PurchaseOrder xmlns:xsi="http://www.w3.org/2001/XMLSchema-instance" xsi:noNamespaceSchemaLocation="http://localhost:8080/source/schemas/poSource/xsd/purchaseOrder.xsd">
   <Reference>DAUSTIN-20021009123338645PDT</Reference>
   <Actions>
      <Action>
         <User>AHUNOLD</User>
      </Action>
   </Actions>
   <Reject/>
   <Requestor>David L. Austin</Requestor>
   <User>DAUSTIN</User>
   <CostCenter>S30</CostCenter>
   <ShippingInstructions>
      <name>David L. Austin</name>
      <address>300 Oracle Parkway
Redwood Shores
CA
94065
USA</address>
      <telephone>650 506 7300</telephone>
   </ShippingInstructions>
   <SpecialInstructions>COD</SpecialInstructions>
   <LineItems>
      <LineItem ItemNumber="1">
         <Description>Fiend without a Face</Description>
         <Part Id="715515011327" UnitPrice="39.95" Quantity="3"/>
      </LineItem>
      <LineItem ItemNumber="2">
         <Description>Armageddon</Description>
         <Part Id="715515010023" UnitPrice="49.99" Quantity="2"/>
      </LineItem>
      <LineItem ItemNumber="3">
         <Description>Nights of Cabiria</Description>
         <Part Id="37429138427" UnitPrice="39.95" Quantity="4"/>
      </LineItem>
      <LineItem ItemNumber="4">
         <Description>Silence of the Lambs</Description>
         <Part Id="715515009133" UnitPrice="39.95" Quantity="4"/>
      </LineItem>
      <LineItem ItemNumber="5">
         <Description>Black Orpheus</Description>
         <Part Id="37429138328" UnitPrice="29.95" Quantity="2"/>
      </LineItem>
      <LineItem ItemNumber="6">
         <Description>The Ruling Class</Description>
         <Part Id="715515012423" UnitPrice="39.95" Quantity="3"/>
      </LineItem>
      <LineItem ItemNumber="7">
         <Description>The Magic Flute</Description>
         <Part Id="37429147528" UnitPrice="29.95" Quantity="3"/>
      </LineItem>
      <LineItem ItemNumber="8">
         <Description>Grey Gardens</Description>
         <Part Id="37429159125" UnitPrice="39.95" Quantity="4"/>
      </LineItem>
      <LineItem ItemNumber="9">
         <Description>Beastie Boys Video Anthology</Description>
         <Part Id="715515010924" UnitPrice="29.95" Quantity="2"/>
      </LineItem>
      <LineItem ItemNumber="10">
         <Description>Withnail &amp; I</Description>
         <Part Id="715515012225" UnitPrice="29.95" Quantity="4"/>
      </LineItem>
      <LineItem ItemNumber="11">
         <Description>I Know Where I'm Going</Description>
         <Part Id="37429154427" UnitPrice="39.95" Quantity="1"/>
      </LineItem>
      <LineItem ItemNumber="12">
         <Description>L'avventura</Description>
         <Part Id="37429156025" UnitPrice="39.95" Quantity="2"/>
      </LineItem>
      <LineItem ItemNumber="13">
         <Description>Chasing Amy</Description>
         <Part Id="717951002372" UnitPrice="39.95" Quantity="1"/>
      </LineItem>
      <LineItem ItemNumber="14">
         <Description>The Bank Dick</Description>
         <Part Id="715515010627" UnitPrice="29.95" Quantity="3"/>
      </LineItem>
      <LineItem ItemNumber="15">
         <Description>Yojimbo</Description>
         <Part Id="37429141328" UnitPrice="29.95" Quantity="2"/>
      </LineItem>
      <LineItem ItemNumber="16">
         <Description>The Rock</Description>
         <Part Id="786936150421" UnitPrice="49.95" Quantity="1"/>
      </LineItem>
      <LineItem ItemNumber="17">
         <Description>Chasing Amy</Description>
         <Part Id="717951002372" UnitPrice="39.95" Quantity="4"/>
      </LineItem>
      <LineItem ItemNumber="18">
         <Description>Samurai 2: Duel at Ichijoji Temple</Description>
         <Part Id="37429125526" UnitPrice="29.95" Quantity="2"/>
      </LineItem>
      <LineItem ItemNumber="19">
         <Description>Dreyer Box Set</Description>
         <Part Id="37429158425" UnitPrice="79.95" Quantity="2"/>
      </LineItem>
      <LineItem ItemNumber="20">
         <Description>Ballad of a Soldier</Description>
         <Part Id="37429167922" UnitPrice="29.95" Quantity="1"/>
      </LineItem>
      <LineItem ItemNumber="21">
         <Description>Dead Ringers</Description>
         <Part Id="715515009249" UnitPrice="39.95" Quantity="2"/>
      </LineItem>
      <LineItem ItemNumber="22">
         <Description>Cries and Whispers</Description>
         <Part Id="37429156322" UnitPrice="29.95" Quantity="3"/>
      </LineItem>
   </LineItems>
</PurchaseOrder>

