<PurchaseOrder xmlns:xsi="http://www.w3.org/2001/XMLSchema-instance" xsi:noNamespaceSchemaLocation="http://localhost:8080/source/schemas/poSource/xsd/purchaseOrder.xsd">
   <Reference>TFOX-20021009123337784PDT</Reference>
   <Actions>
      <Action>
         <User>GCAMBRAU</User>
      </Action>
   </Actions>
   <Reject/>
   <Requestor>Tayler L. Fox</Requestor>
   <User>TFOX</User>
   <CostCenter>R20</CostCenter>
   <ShippingInstructions>
      <name>Tayler L. Fox</name>
      <address>100 Oracle Parkway
Redwood Shores
CA
94065
USA</address>
      <telephone>650 506 7100</telephone>
   </ShippingInstructions>
   <SpecialInstructions>Counter to Counter</SpecialInstructions>
   <LineItems>
      <LineItem ItemNumber="1">
         <Description>And the Ship Sails on</Description>
         <Part Id="37429139028" UnitPrice="29.95" Quantity="3"/>
      </LineItem>
      <LineItem ItemNumber="2">
         <Description>Black Narcissus</Description>
         <Part Id="37429152126" UnitPrice="39.95" Quantity="1"/>
      </LineItem>
      <LineItem ItemNumber="3">
         <Description>Robocop</Description>
         <Part Id="715515009324" UnitPrice="39.95" Quantity="3"/>
      </LineItem>
      <LineItem ItemNumber="4">
         <Description>Sanjuro</Description>
         <Part Id="37429141526" UnitPrice="29.95" Quantity="4"/>
      </LineItem>
      <LineItem ItemNumber="5">
         <Description>Samurai 3: Duel at Ganryu Island</Description>
         <Part Id="37429125625" UnitPrice="29.95" Quantity="1"/>
      </LineItem>
      <LineItem ItemNumber="6">
         <Description>Time Bandits</Description>
         <Part Id="715515010122" UnitPrice="39.95" Quantity="1"/>
      </LineItem>
      <LineItem ItemNumber="7">
         <Description>Orphic Trilogy </Description>
         <Part Id="37429148327" UnitPrice="79.95" Quantity="3"/>
      </LineItem>
      <LineItem ItemNumber="8">
         <Description>The Bank Dick</Description>
         <Part Id="715515010627" UnitPrice="29.95" Quantity="1"/>
      </LineItem>
      <LineItem ItemNumber="9">
         <Description>Spartacus</Description>
         <Part Id="715515011723" UnitPrice="39.96" Quantity="4"/>
      </LineItem>
      <LineItem ItemNumber="10">
         <Description>Orphic Trilogy </Description>
         <Part Id="37429148327" UnitPrice="79.95" Quantity="2"/>
      </LineItem>
      <LineItem ItemNumber="11">
         <Description>Big Deal on Madonna Street</Description>
         <Part Id="37429155424" UnitPrice="29.95" Quantity="1"/>
      </LineItem>
      <LineItem ItemNumber="12">
         <Description>Getrud</Description>
         <Part Id="37429158524" UnitPrice="0.0" Quantity="4"/>
      </LineItem>
      <LineItem ItemNumber="13">
         <Description>Orphic Trilogy </Description>
         <Part Id="37429148327" UnitPrice="79.95" Quantity="1"/>
      </LineItem>
      <LineItem ItemNumber="14">
         <Description>Le Trou</Description>
         <Part Id="37429156223" UnitPrice="29.95" Quantity="2"/>
      </LineItem>
   </LineItems>
</PurchaseOrder>

