<PurchaseOrder xmlns:xsi="http://www.w3.org/2001/XMLSchema-instance" xsi:noNamespaceSchemaLocation="http://localhost:8080/source/schemas/poSource/xsd/purchaseOrder.xsd">
   <Reference>TFOX-20021009123335520PDT</Reference>
   <Actions>
      <Action>
         <User>GCAMBRAU</User>
      </Action>
   </Actions>
   <Reject/>
   <Requestor>Tayler L. Fox</Requestor>
   <User>TFOX</User>
   <CostCenter>R20</CostCenter>
   <ShippingInstructions>
      <name>Tayler L. Fox</name>
      <address>100 Oracle Parkway
Redwood Shores
CA
94065
USA</address>
      <telephone>650 506 7100</telephone>
   </ShippingInstructions>
   <SpecialInstructions>Ground</SpecialInstructions>
   <LineItems>
      <LineItem ItemNumber="1">
         <Description>The Last Temptation of Christ</Description>
         <Part Id="715515010528" UnitPrice="39.95" Quantity="1"/>
      </LineItem>
      <LineItem ItemNumber="2">
         <Description>Time Bandits</Description>
         <Part Id="715515010122" UnitPrice="39.95" Quantity="3"/>
      </LineItem>
      <LineItem ItemNumber="3">
         <Description>Gimme Shelter: The Rolling Stones </Description>
         <Part Id="37429154526" UnitPrice="39.95" Quantity="2"/>
      </LineItem>
      <LineItem ItemNumber="4">
         <Description>Tokyo Olympiad</Description>
         <Part Id="37429166420" UnitPrice="39.95" Quantity="4"/>
      </LineItem>
      <LineItem ItemNumber="5">
         <Description>Dead Ringers</Description>
         <Part Id="715515009249" UnitPrice="39.95" Quantity="1"/>
      </LineItem>
      <LineItem ItemNumber="6">
         <Description>Rashomon  </Description>
         <Part Id="37429161821" UnitPrice="39.95" Quantity="4"/>
      </LineItem>
      <LineItem ItemNumber="7">
         <Description>Oliver Twist</Description>
         <Part Id="37429128121" UnitPrice="39.95" Quantity="3"/>
      </LineItem>
      <LineItem ItemNumber="8">
         <Description>L'avventura</Description>
         <Part Id="37429156025" UnitPrice="39.95" Quantity="2"/>
      </LineItem>
      <LineItem ItemNumber="9">
         <Description>Red Beard</Description>
         <Part Id="37429168820" UnitPrice="39.95" Quantity="3"/>
      </LineItem>
      <LineItem ItemNumber="10">
         <Description>Insomnia</Description>
         <Part Id="37429138229" UnitPrice="29.95" Quantity="3"/>
      </LineItem>
      <LineItem ItemNumber="11">
         <Description>Carnival of Souls</Description>
         <Part Id="715515010221" UnitPrice="39.95" Quantity="4"/>
      </LineItem>
      <LineItem ItemNumber="12">
         <Description>The Unbearable Lightness Of Being</Description>
         <Part Id="37429140222" UnitPrice="29.95" Quantity="1"/>
      </LineItem>
      <LineItem ItemNumber="13">
         <Description>That Obscure Object of Desire</Description>
         <Part Id="37429162026" UnitPrice="29.95" Quantity="4"/>
      </LineItem>
      <LineItem ItemNumber="14">
         <Description>Sid &amp; Nancy</Description>
         <Part Id="715515009232" UnitPrice="39.95" Quantity="1"/>
      </LineItem>
      <LineItem ItemNumber="15">
         <Description>Le million</Description>
         <Part Id="37429147627" UnitPrice="29.95" Quantity="4"/>
      </LineItem>
      <LineItem ItemNumber="16">
         <Description>Ordet</Description>
         <Part Id="37429158623" UnitPrice="0.0" Quantity="4"/>
      </LineItem>
      <LineItem ItemNumber="17">
         <Description>Bob le Flambeur</Description>
         <Part Id="37429165928" UnitPrice="29.95" Quantity="1"/>
      </LineItem>
      <LineItem ItemNumber="18">
         <Description>The Seventh Seal</Description>
         <Part Id="37429124529" UnitPrice="39.95" Quantity="1"/>
      </LineItem>
      <LineItem ItemNumber="19">
         <Description>Cries and Whispers</Description>
         <Part Id="37429156322" UnitPrice="29.95" Quantity="3"/>
      </LineItem>
      <LineItem ItemNumber="20">
         <Description>Peeping Tom</Description>
         <Part Id="37429142929" UnitPrice="39.95" Quantity="2"/>
      </LineItem>
   </LineItems>
</PurchaseOrder>

