<PurchaseOrder xmlns:xsi="http://www.w3.org/2001/XMLSchema-instance" xsi:noNamespaceSchemaLocation="http://localhost:8080/source/schemas/poSource/xsd/purchaseOrder.xsd">
   <Reference>SKING-20021009123337703PDT</Reference>
   <Actions>
      <Action>
         <User/>
      </Action>
   </Actions>
   <Reject/>
   <Requestor>Steven A. King</Requestor>
   <User>SKING</User>
   <CostCenter>A10</CostCenter>
   <ShippingInstructions>
      <name>Steven A. King</name>
      <address>500 Oracle Parkway
Redwood Shores
CA
94065
USA</address>
      <telephone>650 506 7500</telephone>
   </ShippingInstructions>
   <SpecialInstructions>Hand Carry</SpecialInstructions>
   <LineItems>
      <LineItem ItemNumber="1">
         <Description>Insomnia</Description>
         <Part Id="37429138229" UnitPrice="29.95" Quantity="2"/>
      </LineItem>
      <LineItem ItemNumber="2">
         <Description>Haxan: Witchcraft Through the Ages</Description>
         <Part Id="37429161722" UnitPrice="39.95" Quantity="3"/>
      </LineItem>
      <LineItem ItemNumber="3">
         <Description>Walkabout</Description>
         <Part Id="37429123225" UnitPrice="29.99" Quantity="4"/>
      </LineItem>
      <LineItem ItemNumber="4">
         <Description>The Blob</Description>
         <Part Id="715515011129" UnitPrice="39.95" Quantity="3"/>
      </LineItem>
      <LineItem ItemNumber="5">
         <Description>Picnic at Hanging Rock</Description>
         <Part Id="37429126325" UnitPrice="29.95" Quantity="2"/>
      </LineItem>
      <LineItem ItemNumber="6">
         <Description>Salo</Description>
         <Part Id="715515009225" UnitPrice="29.95" Quantity="1"/>
      </LineItem>
      <LineItem ItemNumber="7">
         <Description>Getrud</Description>
         <Part Id="37429158524" UnitPrice="0.0" Quantity="2"/>
      </LineItem>
      <LineItem ItemNumber="8">
         <Description>The Magic Flute</Description>
         <Part Id="37429147528" UnitPrice="29.95" Quantity="1"/>
      </LineItem>
      <LineItem ItemNumber="9">
         <Description>How to Get Ahead in Advertising</Description>
         <Part Id="715515012324" UnitPrice="29.95" Quantity="2"/>
      </LineItem>
      <LineItem ItemNumber="10">
         <Description>Ballad of a Soldier</Description>
         <Part Id="37429167922" UnitPrice="29.95" Quantity="3"/>
      </LineItem>
   </LineItems>
</PurchaseOrder>

