<PurchaseOrder xmlns:xsi="http://www.w3.org/2001/XMLSchema-instance" xsi:noNamespaceSchemaLocation="http://localhost:8080/source/schemas/poSource/xsd/purchaseOrder.xsd">
   <Reference>JCHEN-20021009123337223PDT</Reference>
   <Actions>
      <Action>
         <User>NGREENBE</User>
      </Action>
   </Actions>
   <Reject/>
   <Requestor>John Z. Chen</Requestor>
   <User>JCHEN</User>
   <CostCenter>A10</CostCenter>
   <ShippingInstructions>
      <name>John Z. Chen</name>
      <address>300 North First Street
Belmont
CA
94065
USA</address>
      <telephone>650 506 7200</telephone>
   </ShippingInstructions>
   <SpecialInstructions>Surface Mail</SpecialInstructions>
   <LineItems>
      <LineItem ItemNumber="1">
         <Description>Rififi</Description>
         <Part Id="37429155622" UnitPrice="29.95" Quantity="1"/>
      </LineItem>
      <LineItem ItemNumber="2">
         <Description>Salo</Description>
         <Part Id="715515009225" UnitPrice="29.95" Quantity="1"/>
      </LineItem>
      <LineItem ItemNumber="3">
         <Description>The Horse's Mouth</Description>
         <Part Id="37429168721" UnitPrice="29.95" Quantity="1"/>
      </LineItem>
      <LineItem ItemNumber="4">
         <Description>Robocop</Description>
         <Part Id="715515009324" UnitPrice="39.95" Quantity="3"/>
      </LineItem>
      <LineItem ItemNumber="5">
         <Description>The Last Temptation of Christ</Description>
         <Part Id="715515010528" UnitPrice="39.95" Quantity="3"/>
      </LineItem>
      <LineItem ItemNumber="6">
         <Description>Grand Illusion</Description>
         <Part Id="37429121924" UnitPrice="39.95" Quantity="2"/>
      </LineItem>
      <LineItem ItemNumber="7">
         <Description>The 400 Blows</Description>
         <Part Id="37429122228" UnitPrice="39.95" Quantity="4"/>
      </LineItem>
      <LineItem ItemNumber="8">
         <Description>Sid &amp; Nancy</Description>
         <Part Id="715515009232" UnitPrice="39.95" Quantity="3"/>
      </LineItem>
      <LineItem ItemNumber="9">
         <Description>Henry V</Description>
         <Part Id="37429128527" UnitPrice="39.95" Quantity="2"/>
      </LineItem>
      <LineItem ItemNumber="10">
         <Description>In the Mood for Love</Description>
         <Part Id="715515012928" UnitPrice="39.95" Quantity="4"/>
      </LineItem>
      <LineItem ItemNumber="11">
         <Description>Ordet</Description>
         <Part Id="37429158623" UnitPrice="0.0" Quantity="4"/>
      </LineItem>
      <LineItem ItemNumber="12">
         <Description>Salo</Description>
         <Part Id="715515009225" UnitPrice="29.95" Quantity="1"/>
      </LineItem>
      <LineItem ItemNumber="13">
         <Description>Salesman</Description>
         <Part Id="37429158920" UnitPrice="39.95" Quantity="1"/>
      </LineItem>
      <LineItem ItemNumber="14">
         <Description>Wild Strawberries</Description>
         <Part Id="37429162422" UnitPrice="39.95" Quantity="1"/>
      </LineItem>
      <LineItem ItemNumber="15">
         <Description>The Night Porter</Description>
         <Part Id="37429145227" UnitPrice="29.95" Quantity="2"/>
      </LineItem>
      <LineItem ItemNumber="16">
         <Description>Alphaville</Description>
         <Part Id="37429130926" UnitPrice="29.95" Quantity="1"/>
      </LineItem>
      <LineItem ItemNumber="17">
         <Description>Branded to Kill</Description>
         <Part Id="37429136225" UnitPrice="29.95" Quantity="3"/>
      </LineItem>
      <LineItem ItemNumber="18">
         <Description>Picnic at Hanging Rock</Description>
         <Part Id="37429126325" UnitPrice="29.95" Quantity="1"/>
      </LineItem>
      <LineItem ItemNumber="19">
         <Description>Sullivan's Travels</Description>
         <Part Id="715515012126" UnitPrice="39.95" Quantity="4"/>
      </LineItem>
      <LineItem ItemNumber="20">
         <Description>Armageddon</Description>
         <Part Id="715515010023" UnitPrice="49.99" Quantity="4"/>
      </LineItem>
      <LineItem ItemNumber="21">
         <Description>Hearts and Minds</Description>
         <Part Id="37429166321" UnitPrice="39.95" Quantity="4"/>
      </LineItem>
      <LineItem ItemNumber="22">
         <Description>Rebecca</Description>
         <Part Id="715515012522" UnitPrice="39.95" Quantity="4"/>
      </LineItem>
      <LineItem ItemNumber="23">
         <Description>Mon Oncle</Description>
         <Part Id="37429155929" UnitPrice="29.95" Quantity="4"/>
      </LineItem>
   </LineItems>
</PurchaseOrder>

