<PurchaseOrder xmlns:xsi="http://www.w3.org/2001/XMLSchema-instance" xsi:noNamespaceSchemaLocation="http://localhost:8080/source/schemas/poSource/xsd/purchaseOrder.xsd">
   <Reference>TFOX-20021009123337463PDT</Reference>
   <Actions>
      <Action>
         <User>GCAMBRAU</User>
      </Action>
   </Actions>
   <Reject/>
   <Requestor>Tayler L. Fox</Requestor>
   <User>TFOX</User>
   <CostCenter>R20</CostCenter>
   <ShippingInstructions>
      <name>Tayler L. Fox</name>
      <address>100 Oracle Parkway
Redwood Shores
CA
94065
USA</address>
      <telephone>650 506 7100</telephone>
   </ShippingInstructions>
   <SpecialInstructions>Expedite</SpecialInstructions>
   <LineItems>
      <LineItem ItemNumber="1">
         <Description>George Washington</Description>
         <Part Id="37429166123" UnitPrice="39.95" Quantity="3"/>
      </LineItem>
      <LineItem ItemNumber="2">
         <Description>Nanook of the North</Description>
         <Part Id="715515009829" UnitPrice="29.95" Quantity="1"/>
      </LineItem>
      <LineItem ItemNumber="3">
         <Description>A Nous la Liberte</Description>
         <Part Id="37429147726" UnitPrice="29.95" Quantity="4"/>
      </LineItem>
      <LineItem ItemNumber="4">
         <Description>Children of Paradise</Description>
         <Part Id="37429151723" UnitPrice="39.95" Quantity="3"/>
      </LineItem>
      <LineItem ItemNumber="5">
         <Description>Life of Brian - Monty Python's</Description>
         <Part Id="715515010320" UnitPrice="39.95" Quantity="2"/>
      </LineItem>
      <LineItem ItemNumber="6">
         <Description>Billy Liar</Description>
         <Part Id="37429159224" UnitPrice="39.95" Quantity="2"/>
      </LineItem>
      <LineItem ItemNumber="7">
         <Description>Do the Right Thing</Description>
         <Part Id="715515011228" UnitPrice="39.95" Quantity="2"/>
      </LineItem>
      <LineItem ItemNumber="8">
         <Description>Cries and Whispers</Description>
         <Part Id="37429156322" UnitPrice="29.95" Quantity="1"/>
      </LineItem>
      <LineItem ItemNumber="9">
         <Description>Amarcord</Description>
         <Part Id="37429121825" UnitPrice="39.95" Quantity="1"/>
      </LineItem>
      <LineItem ItemNumber="10">
         <Description>Tokyo Drifter</Description>
         <Part Id="37429136126" UnitPrice="29.95" Quantity="4"/>
      </LineItem>
      <LineItem ItemNumber="11">
         <Description>The Most Dangerous Game</Description>
         <Part Id="37429137321" UnitPrice="24.95" Quantity="1"/>
      </LineItem>
      <LineItem ItemNumber="12">
         <Description>The Last Temptation of Christ</Description>
         <Part Id="715515010528" UnitPrice="39.95" Quantity="4"/>
      </LineItem>
      <LineItem ItemNumber="13">
         <Description>Playtime</Description>
         <Part Id="37429155820" UnitPrice="29.95" Quantity="2"/>
      </LineItem>
      <LineItem ItemNumber="14">
         <Description>L'avventura</Description>
         <Part Id="37429156025" UnitPrice="39.95" Quantity="3"/>
      </LineItem>
      <LineItem ItemNumber="15">
         <Description>Rififi</Description>
         <Part Id="37429155622" UnitPrice="29.95" Quantity="2"/>
      </LineItem>
      <LineItem ItemNumber="16">
         <Description>High and Low</Description>
         <Part Id="37429130322" UnitPrice="39.95" Quantity="4"/>
      </LineItem>
      <LineItem ItemNumber="17">
         <Description>Under the Roofs of Paris</Description>
         <Part Id="37429168929" UnitPrice="29.95" Quantity="2"/>
      </LineItem>
      <LineItem ItemNumber="18">
         <Description>Time Bandits</Description>
         <Part Id="715515010122" UnitPrice="39.95" Quantity="4"/>
      </LineItem>
      <LineItem ItemNumber="19">
         <Description>Gimme Shelter: The Rolling Stones </Description>
         <Part Id="37429154526" UnitPrice="39.95" Quantity="4"/>
      </LineItem>
   </LineItems>
</PurchaseOrder>

